{
  "id": "shared.commerce",
  "layer": "shared",
  "version": 1,
  "dependsOn": ["core.organizations", "shared.billing", "shared.customers"],
  "backend": {
    "djangoApp": "saas_core.modules.shared.commerce",
    "urlPrefix": "/api/v1/commerce",
    "permissions": ["commerce.orders.read", "commerce.payments.manage"],
    "roleGrants": {
      "manager": ["commerce.orders.read", "commerce.payments.manage"],
      "admin": ["commerce.orders.read", "commerce.payments.manage"],
      "owner": ["commerce.orders.read", "commerce.payments.manage"]
    },
    "entitlements": ["commerce.enabled"],
    "eventSchemas": [],
    "publicTables": [],
    "platformTables": []
  },
  "frontend": {
    "routes": ["/panel/orders"],
    "navigation": ["orders"],
    "translationNamespaces": ["Orders"]
  }
}
