{
  "id": "shared.inventory",
  "layer": "shared",
  "version": 1,
  "dependsOn": ["core.identity", "core.organizations", "shared.billing", "shared.notifications"],
  "backend": {
    "djangoApp": "saas_core.modules.shared.inventory",
    "urlPrefix": "/api/v1/inventory",
    "permissions": ["inventory.read", "inventory.use", "inventory.manage"],
    "roleGrants": {
      "viewer": ["inventory.read"],
      "staff": ["inventory.read", "inventory.use"],
      "manager": ["inventory.read", "inventory.use", "inventory.manage"],
      "admin": ["inventory.read", "inventory.use", "inventory.manage"],
      "owner": ["inventory.read", "inventory.use", "inventory.manage"]
    },
    "entitlements": ["inventory.enabled"],
    "eventSchemas": [],
    "publicTables": [],
    "platformTables": []
  },
  "frontend": {
    "routes": ["/panel/inventory"],
    "navigation": ["inventory"],
    "translationNamespaces": ["Inventory"]
  }
}
