{
  "id": "shared.image-generation",
  "layer": "shared",
  "version": 1,
  "dependsOn": [
    "core.organizations",
    "shared.billing",
    "shared.media",
    "shared.sites"
  ],
  "backend": {
    "djangoApp": "saas_core.modules.shared.image_generation",
    "urlPrefix": "/api/v1/image-generation",
    "permissions": ["image_generation.run"],
    "roleGrants": {
      "manager": ["image_generation.run"],
      "admin": ["image_generation.run"],
      "owner": ["image_generation.run"]
    },
    "entitlements": ["image_generation.enabled"],
    "eventSchemas": [],
    "publicTables": [],
    "platformTables": [],
    "beatSchedule": {
      "image-generation-reconcile": {
        "task": "saas_core.modules.shared.image_generation.tasks.reconcile_image_generation_jobs",
        "schedule": 60
      }
    }
  },
  "frontend": {
    "routes": [],
    "navigation": [],
    "translationNamespaces": ["ImageGeneration"]
  }
}
