{
  "id": "core.organizations",
  "layer": "core",
  "version": 1,
  "dependsOn": ["core.identity"],
  "backend": {
    "djangoApp": "saas_core.modules.core.organizations",
    "urlPrefix": "/api/v1/organizations",
    "permissions": [
      "organization.read",
      "organization.members.manage",
      "organization.members.read",
      "organization.members.manage_limited",
      "organization.settings.manage",
      "organization.ownership.transfer",
      "organization.archive"
    ],
    "entitlements": [],
    "eventSchemas": ["organizations.organization.created.v1"],
    "publicTables": [],
    "platformTables": []
  },
  "frontend": {
    "routes": ["/organizations"],
    "navigation": ["organizations"],
    "translationNamespaces": ["organizations"]
  }
}
