{
  "id": "shared.profiles",
  "layer": "shared",
  "version": 1,
  "dependsOn": [
    "core.organizations",
    "shared.media",
    "shared.notifications",
    "shared.sites"
  ],
  "backend": {
    "djangoApp": "saas_core.modules.shared.profiles",
    "urlPrefix": "/api/v1/profiles",
    "permissions": ["profiles.manage"],
    "entitlements": ["profiles.enabled"],
    "eventSchemas": [],
    "publicTables": ["profiles_catalogentry"],
    "platformTables": []
  },
  "frontend": {
    "routes": ["/profiles", "/katalog"],
    "navigation": ["profiles"],
    "translationNamespaces": ["profiles"]
  }
}
