{
  "id": "shared.booking",
  "layer": "shared",
  "version": 1,
  "dependsOn": [
    "core.organizations",
    "shared.notifications",
    "shared.profiles"
  ],
  "backend": {
    "djangoApp": "saas_core.modules.shared.booking",
    "urlPrefix": "/api/v1/booking",
    "permissions": [
      "booking.appointment.read",
      "booking.appointment.manage",
      "booking.schedule.own"
    ],
    "roleGrants": {
      "staff": ["booking.schedule.own"]
    },
    "entitlements": ["booking.enabled"],
    "eventSchemas": ["booking.appointment.created.v1"],
    "publicTables": [],
    "platformTables": []
  },
  "frontend": {
    "routes": ["/calendar"],
    "navigation": ["calendar"],
    "translationNamespaces": ["booking"]
  }
}
