{
  "id": "shared.customers",
  "layer": "shared",
  "version": 1,
  "dependsOn": ["core.organizations"],
  "backend": {
    "djangoApp": "saas_core.modules.shared.customers",
    "urlPrefix": "/api/v1/customers",
    "permissions": ["customers.read", "customers.manage"],
    "roleGrants": {
      "manager": ["customers.read"],
      "admin": ["customers.read", "customers.manage"],
      "owner": ["customers.read", "customers.manage"]
    },
    "entitlements": [],
    "eventSchemas": [],
    "publicTables": [],
    "platformTables": []
  },
  "frontend": {
    "routes": ["/panel/settings/documents", "/documents"],
    "navigation": [],
    "translationNamespaces": ["CustomerDocuments", "CustomerDocument"]
  }
}
